<?xml version="1.0" encoding="UTF-8"?>
<!--<concesionario>-->
<!--    <coche matricula="6732KPC">-->
<!--        <marca>Seat Ateca</marca>-->
<!--        <combustible>Gasolina</combustible>-->
<!--        <precio>23000</precio>-->
<!--    </coche>-->
<!--    <coche matricula="8280KWT">-->
<!--        <marca>Volkswagen Golf</marca>-->
<!--        <combustible>Diesel</combustible>-->
<!--        <precio>25000</precio>-->
<!--    </coche>-->
<!--</concesionario>-->

<concesionario xmlns:xsi="http://www.w3.org/2001/XMLSchema-instance" xsi:noNamespaceSchemaLocation="coches.xsd"
provincia="Madrid">
    <coche matricula="6732KPC">
        <marca>Seat</marca>
        <modelo>Ateca</modelo>
        <cv>150</cv>
        <combustible>Gasolina</combustible>
        <precio>23000</precio>
        <a単o>2025</a単o>
        <interesado>33329438t</interesado>
        <fecha_limite>31/12/2025</fecha_limite>
    </coche>

    <coche matricula="8280KWT">
        <marca>Volkswagen</marca>
        <modelo>Golf</modelo>
        <cv>120</cv>
        <combustible>Diesel</combustible>
        <precio>25000</precio>
        <a単o>2024</a単o>
        <interesado>33454538t</interesado>
        <fecha_limite>31/12/2025</fecha_limite>
    </coche>


</concesionario>
